phrases,cluster_labels
I was playing basketball and Jerry ran into me and the inside of my knee hurts.,3
I landed on my side I was not able to continue on.,3
On the inside,1
Yes it hurts,1
I do see some ecchymosis and swelling on the inside of that knee and when I push around that knee I can see that there is fluid in the knee a little bit of fluid in the knee we call that effusion.,2
There is a negative varus and valgus stress test.,0
The bony alignment's in good position I don't see any evidence of any fractures I do notice the effusion around the knee.,2
You have may have a medial collateral ligament strain from maybe the twisting motion before you fell to the ground.,0
